{
  "schema_version": "1.0",
  "revision": 1,
  "generated_at": "2026-10-12T00:00:00.000Z",
  "observer": {
    "actor_activity": {
      "CHAT": false,
      "MCP": false,
      "RDC": false,
      "TERM": false,
      "OC": false,
      "QWEN": false,
      "LLAMA": false,
      "GIT": false
    },
    "timeline": [],
    "spans": [],
    "llama": "slot0:idle"
  },
  "project_tasks": {
    "schema_version": "1.0",
    "tasks": [],
    "recommended": null,
    "current_admission": null,
    "envelope": {
      "ready": false,
      "status": "PLANNING_REQUIRED"
    }
  },
  "rdc": {},
  "prepared_dispatch": {
    "ready": false
  },
  "executor_policy": {
    "schema_version": "1.0",
    "mode": "AUTO",
    "updated_at": null,
    "updated_by": null,
    "compare_root": "/example",
    "semantics": {
      "AUTO": "Harness chooses.",
      "EDH": "EDH path.",
      "RDC": "RDC path.",
      "COMPARE": "Comparison path."
    }
  }
}
